{
  "apiVersion": "v1.0",
  "name": "minimal-three-step",
  "description": "Linear sequence of three task nodes with no branching, inputs, or triggers.",
  "nodes": [
    {
      "id": "step-1",
      "type": "task",
      "taskType": "fetch-record",
      "next": "step-2"
    },
    {
      "id": "step-2",
      "type": "task",
      "taskType": "transform-record",
      "next": "step-3"
    },
    {
      "id": "step-3",
      "type": "task",
      "taskType": "persist-record"
    }
  ]
}
